id,city,title,time,category,latitude,longitude,price,price_per_meter,meterage,floor,all_floors,build_date,rooms,elevator,parking,warehouse,jahat,vahed,sanad,status,image,description
1,زنجان, زیباشهر ویلایی تک واحد جنوبی  160 متری, ۲ ساعت پیش در زنجان, فروش خانه و ویلا, '', '', ۱۱۱٬۱۱۱ تومان, ۰ تومان, ۱۱۰, '', '', ۱۳۷۸, ۲, 1, 1, 1, جنوبی, '', تک برگ, بازسازی نشده, '', فروش نقدی یا معاوضه با ویلایی متراژ بالاتر در زیباشهر یا اراضی مابقی نقد
2,زنجان, آپارتمان واقع در گلشهر فاز ۳, ۲ ساعت پیش در زنجان, فروش آپارتمان, '', '', ۱٬۰۸۰٬۰۰۰٬۰۰۰ تومان, ۱۱٬۳۶۸٬۰۰۰ تومان, ۹۵, ' ', '', ۱۴۰۳, ۲, 1, 1, 1, '', '', '', بازسازی نشده, https://s100.divarcdn.com/static/photo/afra/post/tQDydAtFoWKrLwWmrmXTWQ/6ec65bfe-77f7-44d5-945e-8e538c0be21c.jpg, آپارتمان علوم پزشکی واقع در فاز ۲ گلشهر .\n۹۵ متر . نورگیر از همه جهت اتاق خواب ها و آشپزخانه و پذیرایی . بالکن بزرگ  دارد . ویو ابدی . تمامیه واریزی ها به موقع .یه ماهه انتخاب واحد انجام میشود  .بدهی به شرکت ۷۱۰ ملیون .
3,زنجان, نانوایان فازسه /۱۲۰متر/ واحد دونبش, ۲ ساعت پیش در زنجان, فروش خانه و ویلا, 36.68839, 48.46687, ۱۱۱٬۱۱۱٬۱۱۱ تومان, ۶۹۴٬۰۰۰ تومان, ۱۲۰, '', '', ۱۴۰۲, ۲, 0, 1, 1, '', '', '', '', https://s100.divarcdn.com/static/photo/afra/post/UBtz99PsUtVTAx-IT4h6zw/be43fed1-8906-4429-856c-6b146dcf6fe4.jpg, طبقه وسط\nورودی مجزا \nکف سرامیک \nکناف کاری شده \nدودانگ وکالت بلاعزل \n\nمسکن غلامی واقع در خیابان عاصم زنجانی
4,زنجان, کوی صدرا/ ۱۶۶متر/ سه طبقه, ۳ ساعت پیش در زنجان, فروش خانه و ویلا, 36.688282, 48.456287, ۸٬۰۰۰٬۰۰۰٬۰۰۰ تومان, ۴۸٬۱۹۲٬۰۰۰ تومان, ۳۶۰, '', '', ۱۳۹۶, ۴, 1, 1, 1, '', '', '', '', https://s100.divarcdn.com/static/photo/afra/post/R7P-HMBYbfBYxuzW_ulC0g/80ce7320-82a3-4bc7-b42b-72c62b452eba.jpg, زمین ۱۶۶متر \nبنا ۳۶۰متر \nفروش بصورت تکی وکلی \nهمکف خشک \nطبقه اول ودوم تجهیز شده \n\nمسکن غلامی واقع در خیابان عاصم زنجانی
5,زنجان, مجتمع ارغوان گلشهر, ۳ ساعت پیش در زنجان, فروش آپارتمان, 36.670750796111, 48.561796178973, ۱٬۸۰۰٬۰۰۰٬۰۰۰ تومان, ۲۵٬۷۱۴٬۰۰۰ تومان, ۷۰, ' ', '', ۱۳۹۴, ۲, 1, 1, 0, '', '', '', بازسازی نشده, https://s100.divarcdn.com/static/photo/afra/post/0_g7oiyKAc1ih3x8Yh-Cyw/d0ff8112-3033-4e60-9784-6edd382619aa.jpg, ♦️گلشهر دور میدان امام حسین(ع)\n♦️هر دو اتاق ق خواب نورگیر عالی و ویو ابدی\n♦️پارکینگ محوطه (مکان مشخص و شماره گذاری شده)\n♦️تازه کاغذدیواری شده ، گرمایش پکیج، کف موکت\n♦️مج  جتمع مجهز به دوربین مداربسته و نگهبانی ۲۴ ساعته \n♦️سند آزاد \n♦️دسترسی آسان به مراکز خرید و حمل و نقل عمومی
6,زنجان, باغ در جاده بیجار ۳۱۰۰متر, ۳ ساعت پیش در زنجان, فروش خانه و ویلا, '', '', ۶۰۰٬۰۰۰٬۰۰۰ تومان, ۱۹۳٬۰۰۰ تومان, ۱۸, '', '', ۱۳۹۸, بدون اتاق, 1, 1, 0, '', '', '', بازسازی نشده, https://s100.divarcdn.com/static/photo/afra/post/_HEOlYHgE7RGxdjWx1GKwA/43cb4710-3d7b-44f2-a078-8637d42817c3.jpg, باغ خصوصی در جاده بیجار \nاز خیام ۸ دقیقه راه هست راه اختصاصی دارد \n۲۵۰۰متر باغ فنس کشی شده دارای استخر \nدارای آب فقط روزهای جمعه ۲۴ ساعت\nدارای درختان هلو الو گیلاس آلبالو زردآلو سنجد شلیل بادام گردو گلابی سیب توت و تعدادی گل محمدی و انگور آبیاری قطره ای \nکه همه در عکس گویاست اکثر درختان امسال کلا بار داده اند \nو اتاق نیمه کاره داره و انباری و دستشویی داره